[
  {
    "fact_id": "fact_experiment_conducted",
    "case_id": "case_clockmaker_01",
    "summary": "失踪者在工坊进行了未经批准的实验",
    "truth": true,
    "secrecy": "core_secret",
    "prerequisite_fact_ids": [],
    "revealed_by_clue_ids": ["clue_lab_notes", "clue_material_receipt"]
  },
  {
    "fact_id": "fact_ritual_failed",
    "case_id": "case_clockmaker_01",
    "summary": "实验仪式失败导致异常能量释放",
    "truth": true,
    "secrecy": "core_secret",
    "prerequisite_fact_ids": ["fact_experiment_conducted"],
    "revealed_by_clue_ids": ["clue_burn_pattern", "clue_residual_energy"]
  },
  {
    "fact_id": "fact_entity_unleashed",
    "case_id": "case_clockmaker_01",
    "summary": "仪式失败释放了一个灵体实体",
    "truth": true,
    "secrecy": "core_secret",
    "prerequisite_fact_ids": ["fact_ritual_failed"],
    "revealed_by_clue_ids": ["clue_spirit_vision_entity", "clue_trapped_clock"]
  },
  {
    "fact_id": "fact_material_source",
    "case_id": "case_clockmaker_01",
    "summary": "失踪者从神秘材料店购得稀有材料",
    "truth": true,
    "secrecy": "restricted",
    "prerequisite_fact_ids": [],
    "revealed_by_clue_ids": ["clue_material_receipt", "clue_shopkeeper_testimony"]
  },
  {
    "fact_id": "fact_witness_sound",
    "case_id": "case_clockmaker_01",
    "summary": "邻居在失踪当晚听到持续15分钟的沉重敲击声",
    "truth": true,
    "secrecy": "public",
    "prerequisite_fact_ids": [],
    "revealed_by_clue_ids": ["clue_neighbor_testimony"]
  },
  {
    "fact_id": "fact_doctor_visit",
    "case_id": "case_clockmaker_01",
    "summary": "医生在失踪前三天拜访过失踪者，为他开了镇静剂",
    "truth": true,
    "secrecy": "restricted",
    "prerequisite_fact_ids": [],
    "revealed_by_clue_ids": ["clue_medical_record", "clue_doctor_testimony"]
  },
  {
    "fact_id": "fact_doctor_prescribed",
    "case_id": "case_clockmaker_01",
    "summary": "医生开出的镇静剂可能影响失踪者的判断力",
    "truth": true,
    "secrecy": "restricted",
    "prerequisite_fact_ids": ["fact_doctor_visit"],
    "revealed_by_clue_ids": ["clue_medical_record"]
  },
  {
    "fact_id": "fact_workshop_damage",
    "case_id": "case_clockmaker_01",
    "summary": "工坊内部有不规则灼痕和异常灵性残留",
    "truth": true,
    "secrecy": "restricted",
    "prerequisite_fact_ids": ["fact_ritual_failed"],
    "revealed_by_clue_ids": ["clue_burn_pattern", "clue_residual_energy"]
  },
  {
    "fact_id": "fact_entity_bound",
    "case_id": "case_clockmaker_01",
    "summary": "释放的灵体实体被束缚在工坊的旧钟表中",
    "truth": true,
    "secrecy": "core_secret",
    "prerequisite_fact_ids": ["fact_entity_unleashed"],
    "revealed_by_clue_ids": ["clue_trapped_clock", "clue_spirit_vision_entity"]
  },
  {
    "fact_id": "fact_entity_neutralized",
    "case_id": "case_clockmaker_01",
    "summary": "通过正确仪式可以安全中和束缚的灵体实体",
    "truth": true,
    "secrecy": "core_secret",
    "prerequisite_fact_ids": ["fact_entity_bound", "fact_material_source"],
    "revealed_by_clue_ids": ["clue_collector_knowledge", "clue_shopkeeper_testimony"]
  },
  {
    "fact_id": "fact_landlord_hid_evidence",
    "case_id": "case_clockmaker_01",
    "summary": "房东发现异常后试图销毁部分证据",
    "truth": true,
    "secrecy": "restricted",
    "prerequisite_fact_ids": [],
    "revealed_by_clue_ids": ["clue_burnt_documents", "clue_landlord_contradiction"]
  },
  {
    "fact_id": "fact_clockmaker_location",
    "case_id": "case_clockmaker_01",
    "summary": "失踪者处于失神状态，躲在废弃钟表工坊的暗格中",
    "truth": true,
    "secrecy": "core_secret",
    "prerequisite_fact_ids": ["fact_entity_unleashed"],
    "revealed_by_clue_ids": ["clue_hidden_compartment", "clue_police_report"]
  }
]
